cuisine	types	name	ingredients	difficulty	health_banners
['british']	['dessert', 'snack']	Instant frozen berry yogurt	['250g frozen mixed berry', '250g 0%-fat Greek yogurt', '1 tbsp honey or agave syrup']	Easy	['Gluten-free', 'Healthy', 'Vegetarian']
	['dinner', 'main-course', 'supper']	Roast aubergine & coconut curry	['800g aubergines (about 3), sliced into rounds, then cut into quarters', '4 tbsp coconut or olive oil', '2 onions, chopped', '2cm piece of ginger, grated to a pulp', '3 garlic cloves, grated to a pulp', '2 red chillies, halved, deseeded and chopped', '1 tsp ground turmeric', '2 tsp ground coriander', '4 black cardamom pods, crushed a little (but not so much that the pods open)', '6 large plum tomatoes, roughly chopped', '3 x 160ml cans of  coconut cream ', 'juice ½ lime', 'small bunch coriander, leaves only', 'rice or naan breads, to serve']	Easy	['Gluten-free', 'Vegan', 'Vegetarian']
['british']	['afternoon-tea', 'buffet', 'dessert', 'dinner', 'lunch', 'treat']	Decadent chocolate truffle torte	['250g dark chocolate', '2 tbsp golden syrup', '568ml carton double cream', '4 tsp instant coffee  granules', '1 tsp ground cinnamon', 'cocoa powder, for dusting']	More effort	['Freezable']
	['dinner', 'supper']	Mustardy sausage & sprout gnocchi	['250g gnocchi', '1 tbsp olive oil', '1 onion, thinly sliced', '3 pork sausages (200g)', '250g sprouts, shredded', '100ml chicken stock', '2 tsp wholegrain mustard', '2 tbsp half-fat crème fraîche', '½ small bunch of parsley, chopped, plus extra to serve', 'parmesan, grated (optional)']	Easy	[]
['thai']	['dinner', 'lunch', 'main-course', 'supper']	Thai chicken cakes with sweet chilli sauce	['2 large boneless, skinless  chicken breasts  (about 175g), cubed', '1 garlic clove, roughly chopped', 'small piece fresh  root ginger, peeled and roughly chopped', '1 small onion, roughly chopped', '4 tbsp fresh  coriander, plus a few sprigs to garnish', '1 green chilli, seeded and roughly chopped', '2 tbsp  olive oil', 'sweet chilli sauce, lime wedges, shredded spring onion and red chilli, to serve']	Easy	['Freezable']
	['side-dish', 'vegetable']	Chilli-charred brussels sprouts	['600g brussels sprouts, trimmed at the base', '60ml olive oil', '4 garlic cloves, peeled and bashed', '1-2 tsp chilli flakes', '1 lemon, zested and juiced']	Easy	['Freezable', 'Dairy-free', 'Gluten-free', 'Healthy', 'Vegan', 'Vegetarian']
	['dessert']	White chocolate & raspberry ripple baked cheesecake	['225g digestive biscuits', '15g freeze-dried raspberries (optional)', '115g butter, melted', '250g fresh or frozen raspberries', '½ lemon, juiced', '175g caster sugar, plus 2 tsp', '600g full-fat soft cheese', '3 large eggs, plus 2 egg yolks', '175g double cream', '1 tbsp vanilla bean paste', '350g white chocolate']	More effort	[]
	['breakfast', 'brunch']	Sweetcorn fritters with eggs & black bean salsa	['1 tsp rapeseed oil', '1 small red onion (85g), finely chopped', '1 red pepper, deseeded and finely diced', '100g wholemeal self-raising flour', '1 tsp smoked paprika', '1 tsp ground coriander', '1 tsp baking powder', '325g can sweetcorn, drained', '6 large eggs', '1 small red onion (85g), finely chopped', '4 tomatoes (320g), chopped', '2 x 400g cans black beans, drained', '1 lime, zested and juiced', '½ x 30g pack coriander, chopped']	Easy	['Healthy', 'Vegetarian']
	['dessert']	Eggless chocolate & beetroot blitz & bake cake	['100ml rapeseed oil, plus extra for greasing', '175g (drained weight) vacuum-packed  beetroot (not in vinegar)', '175g dark soft brown sugar', '200g self-raising flour', '1 tbsp baking powder', '50g cocoa powder', '200g 0% fat  natural yogurt', '2 tsp vanilla extract', '100g icing sugar', '50g dark chocolate (at least 80% cocoa solids)', '1 tbsp cocoa powder', '3 tbsp skimmed milk', 'dark chocolate shavings, to serve (optional)']	Easy	['Freezable']
	['dinner', 'main-course', 'pasta']	5-a-day Bolognese	['1 ½ tbsp  olive oil', '150g beef mince', '2 onions, finely chopped', '2 leeks, finely sliced', '1-2 garlic cloves, crushed', '1 red pepper, chopped into small pieces', '1 large courgette, chopped into small pieces', '1 can chopped tomatoes', '2 tbsp tomato purée', '50ml chicken or beef stock', '½ tsp dried oregano', '150g spaghetti', '25g parmesan, finely grated', 'a few basil leaves (optional)']	More effort	['Freezable']
['chinese']	['dinner', 'main-course']	Special fried rice	['100g basmati rice or long-grain rice', '85g frozen peas', '1 tbsp sunflower oil', '1 egg, beaten', '1 garlic clove, chopped', '3 spring onions, sliced on an angle', '½ red pepper, deseeded and chopped', 'good pinch five spice powder', '100g beansprouts', '1 tsp soy sauce', '50g finely diced chorizo, bacon or ham (optional)', '50g peeled prawns (optional)']	Easy	['Easily doubled', 'Healthy']
['italian']	['dessert', 'dinner']	Coffee semifreddo	['1 tbsp instant coffee', '1 tbsp Tia Maria or brandy', '4 large eggs, separated', '100g golden caster sugar', '300ml pot double cream', '100g/4oz pack honeycomb Toblerone, finely chopped', 'dark chocolate curls, to decorate']	Easy	['Freezable']
	['dinner', 'fish-course', 'lunch', 'main-course']	Salmon with beetroot, feta & lime salsa	['200g cooked beetroot', '70g feta', '2 limes', '2 skin-on salmon fillets']	Easy	['Gluten-free']
['italian']	['dinner', 'main-course', 'supper']	Gnocchi with courgette, mascarpone & spring onions	['300g fresh gnocchi', '1 tbsp olive oil', '1 red chilli, sliced, deseeded if you like', '1 medium courgette, cut into thin ribbons with a peeler', '4 spring onions, chopped', 'zest 1 lemon', '2 heaped tbsp mascarpone', '50g parmesan (or vegetarian alternative), grated', 'dressed mixed leaves, to serve']	Easy	['Vegetarian']
['indian']	['dinner', 'main-course']	Spinach & chickpea curry	['2 tbsp mild curry paste', '1 onion, chopped', '400g can  cherry tomatoes', '2 x 400g cans chickpeas, drained and rinsed', '250g bag  baby leaf spinach', 'squeeze  lemon juice', 'basmati rice, to serve']	Easy	['Freezable', 'Vegan', 'Vegetarian']
['italian']	['dessert', 'dinner']	Coffee semifreddo	['1 tbsp instant coffee', '1 tbsp Tia Maria or brandy', '4 large eggs, separated', '100g golden caster sugar', '300ml pot double cream', '100g/4oz pack honeycomb Toblerone, finely chopped', 'dark chocolate curls, to decorate']	Easy	['Freezable']
	['dinner', 'fish-course', 'lunch', 'main-course']	Salmon with beetroot, feta & lime salsa	['200g cooked beetroot', '70g feta', '2 limes', '2 skin-on salmon fillets']	Easy	['Gluten-free']
	['dinner', 'pasta', 'supper']	Easy spaghetti Bolognese	['3 tbsp olive oil', '300g beef mince', '200g pork mince', '2 large shallots, finely chopped', '2-3  garlic cloves, crushed', '500g passata', '1 tbsp tomato purée', '100ml red wine', '1 tsp dried oregano', '400g spaghetti', '50g parmesan, finely grated', 'a few basil leaves']	Easy	[]
	['dinner']	One-pot goulash pasta	['2 tbsp rapeseed oil', '2 onions (about 340g), chopped', '500g 5%-fat steak mince', '2 peppers, deseeded and finely chopped', '3 garlic cloves, chopped', '1 tbsp thyme leaves', '2 tbsp smoked paprika', '400g can chopped tomatoes', '2 tbsp tomato purée', '800ml hot vegetable stock, made with 2 tsp bouillon powder', '180g wholemeal penne']	Easy	['Freezable', 'Healthy', 'Low calorie']
['mexican']	['dessert']	Tres leches cake (milk cake)	['flavourless oil, for the tin', '4 eggs, separated', '200g caster sugar', '1 tsp vanilla extract', '200g plain flour', '1 tsp baking powder', '100ml milk', '410g can evaporated milk', '200ml sweetened condensed milk', '300ml double cream', '2 tbsp icing sugar', 'pinch cinnamon']	More effort	['Vegetarian']
	['dinner']	Leek risotto	['2 tbsp olive oil', '500g leeks, 80g cut lengthways into strips, the rest finely sliced', '75g butter', '2 celery sticks, finely chopped', '2 carrots, finely chopped', '300g risotto rice (carnaroli or arborio work well)', '175ml white wine', '1-1.5 litres hot vegetable or chicken stock', '50g grated parmesan or vegetarian alternative, plus extra to serve']	Easy	['Vegetarian']
['indian']	['side-dish']	Easy pilau rice	['300g basmati rice', '30g butter or 2 tbsp sunflower oil ', '1 large onion, chopped ', '1 cinnamon stick', '1 tsp cumin seeds', '6 cardamom pods, bashed', '4 cloves', '2 bay leaves', '½ tsp ground coriander', '½ tsp ground turmeric', '500ml vegetable stock or water']	Easy	['Egg-free', 'Low fat', 'Low sugar', 'Nut-free', 'Vegetarian']
	['dinner', 'main-course']	Slow cooker meatballs	['1 tbsp rapeseed oil', '1 onion, finely chopped', '2 carrots, finely diced', '2 celery sticks, finely diced', '2 garlic cloves, thinly sliced', '500g carton tomato passata', '2 tbsp chopped parsley', '400g lean mince turkey', '4 tbsp porridge oats', 'pinch paprika', '1 garlic clove, crushed', 'spray of oil']	Easy	['Freezable', 'Healthy', 'High-protein', 'Low fat']
['italian']	['dinner', 'main-course']	Leek & bacon risotto	['1 ½l chicken stock', '1 tbsp olive oil', '4 streaky smoked bacon rashers, cut into pieces', '3 large leeks, chopped', '300g risotto rice', '125ml white wine', '50g grated parmesan', '1 bunch chives, chopped']	Easy	[]
	['dinner']	Baked cod	['3 tbsp plain flour', '4 cod loin fillets ', '2 tbsp  olive oil', '1 lemon, sliced ', '½ small bunch of thyme']	Easy	['Healthy']
		Sourdough hot cross buns	['300g active sourdough starter  (see recipe, below)', '2 large eggs, beaten', '200ml milk', '500g strong white bread flour, plus extra for dusting', '60g golden caster sugar', '1 tsp ground cinnamon', '1 tsp mixed spice', '1 orange, zested', '150g raisins, or a mixture of small dried fruits (such as raisins, mixed peel and cranberries)', '100g unsalted butter, softened']	More effort	['Vegetarian']
	['afternoon-tea', 'dessert', 'treat']	Cherry crumble cake	['180g salted butter, softened, plus extra for the tin', '220g golden caster sugar', '3 large eggs, lightly beaten', '250g self-raising flour', '½ tsp baking powder', '50g ground almonds', '80g soured cream', '300g fresh cherries, stoned and halved', '45g plain flour', '35g cold salted butter, cubed', '20g golden caster sugar']	Easy	['Freezable', 'Vegetarian']
['mediterranean']	['dinner']	Layered aubergine & lentil bake	['2 aubergines, cut into 0.5cm slices lengthways', '3 tbsp olive oil', '140g puy lentils', '2 onions, finely chopped', '3 garlic cloves, finely chopped', '300g cooked  butternut squash', '400g can  chopped tomato', '½ small pack  basil leaves', '125g ball of mozzarella, torn']	Easy	['Freezable', 'Gluten-free', 'Healthy', 'Vegetarian']
		Crab apple jelly	['1½ kg crab apples', '1 lemon, zest pared and half juiced', 'around 450g white caster or granulated sugar', 'Jelly bag']	Easy	['Easily doubled', 'Easily halved', 'Dairy-free', 'Egg-free', 'Gluten-free', 'Vegetarian']
['indian']	['dessert', 'treat']	Coconut chai traybake	['100ml vegetable oil, plus a little for greasing', '300ml coconut milk (not low-fat) - if the cream has separated in the can, give it a good mix before measuring', '4 large eggs', '2 tsp vanilla extract', '280g light brown soft sugar', '250g self-raising flour', '75g desiccated coconut', '1 tsp ground ginger', '1 tsp ground cinnamon', '¼ nutmeg, finely grated', '¼ tsp ground cloves', '10 cardamom pods, seeds removed and crushed using a pestle and mortar', '4 tbsp ginger syrup', '3-4 tbsp coconut milk', '140g icing sugar', '2 balls stem ginger, finely chopped', 'chopped pistachios and coconut flakes (optional)']	Easy	['Freezable (un-iced)', 'Vegetarian']
	['dessert']	Chocolate orange brownie tart	['320g pack ready-made shortcrust pastry', '120g  dark chocolate, chopped', '120g butter, cubed', '2 eggs', '80g  golden caster sugar', '80g  light brown soft sugar', '80g  plain flour', '1 orange, zested and juiced plus more zest to serve', 'crème fraîche to serve']	Easy	['Freezable', 'Vegetarian']
['scottish']	['afternoon-tea', 'dessert']	Dundee cake	['100g blanched almonds', '180g unsalted butter, at room temperature', '180g light muscovado sugar', 'zest 1 large orange', '3 tbsp apricot jam or marmalade', '225g plain flour', '1 tsp baking powder', '3 large  eggs, beaten', '100g ground almonds', '2 tbsp milk', '500g mixed dried fruit', '100g whole glacé cherry', '1 tbsp milk', '2 tsp caster sugar']	Easy	[]
['british']	['dinner', 'main-course']	Cheese & bacon lasagne	['3 large onions, halved and thinly sliced', '3 tbsp olive oil', '1 tsp dried oregano', '300g pack lean smoked back bacon, chopped', '2 x 400g cans chopped tomatoes in rich juice', '20 basil leaves, roughly torn, plus extra to serve if you like', '250g pack fresh egg lasagne (check pack for cooking instructions)', '600ml milk', '50g each butter and plain flour', 'generous grating fresh nutmeg', '50g grated parmesan']	Easy	['Freezable']
['british']	['dinner', 'main-course', 'supper']	Crumbly chicken & mixed vegetable pie	['1 onion', '40g butter', '100g button mushroom', '40g plain flour, plus extra for dusting', '400ml milk, warmed', '1 chicken stock cube', 'pinch  nutmeg', 'pinch  mustard powder', 'bay leaf', '250g cooked chicken', '200g mix of sweetcorn, peas, chopped, peppers, broccoli, carrots or other veg', '250g shortcrust pastry', '1 egg, beaten or milk, for glazing']	Easy	[]
['american']	['afternoon-tea', 'breakfast', 'brunch', 'dessert', 'treat']	Monkey bread	['200ml semi-skimmed milk', '85g unsalted butter', '2 large eggs', '550g strong white bread flour, plus extra for kneading if doing it by hand', '2½ tsp fast-action dried yeast', '50g golden caster sugar', 'oil, for greasing', '125g unsalted butter, plus extra for greasing\t', '1 tbsp ground cinnamon', '1 tsp ground ginger', '1 tsp ground nutmeg', '225g light muscovado sugar', '140g pecans, toasted then roughly chopped ', '100g icing sugar, sifted', '½ tsp vanilla extract', '1 tbsp semi-skimmed milk', 'pinch of ground cinnamon', '2 tbsp unsalted butter, melted']	Easy	['Freezable (raw, before final proving)']
	['dessert']	Millionaire's chocolate brownie tart	['175g plain flour, plus extra for dusting', '85g icing sugar', '50g cocoa powder', '140g cold butter, cut into cubes', '2 egg yolks, lightly beaten', '150g butter, chopped', '200g dark chocolate, broken into pieces', '2 eggs', '200g golden caster sugar', '75g cocoa powder, plus extra to serve', '18 caramel-filled chocolates']	More effort	['Vegetarian']
	['buffet', 'dinner', 'main-course', 'side-dish', 'snack', 'supper']	Watercress & chicken stir-fry	['1 tbsp sunflower oil', '2 skinless and boneless chicken breasts, cut into strips', '100g cashew nuts ', '1 red or yellow pepper,  deseeded and chopped into large chunks', '1 red onion,  chopped into large chunks', '2 x 75g bags watercress', 'cooked rice, to serve (optional)', '3 tbsp hoisin sauce', '2 tbsp soy sauce', '1 large knob of fresh ginger,  peeled and finely grated', '2 garlic cloves, crushed  ', '1 tbsp sesame oil', '2 tbsp rice vinegar  or white wine vinegar']	Easy	['Easily halved']
	['dinner', 'main-course']	Easy vegan wellington	['90g dried porcini mushrooms', '2 tbsp olive oil', '1 large onion, finely chopped', '250g chestnut mushrooms, finely chopped', '2 garlic cloves, crushed', '500g sweet potatoes (about 2 large), peeled and cut into 2cm chunks', '1 tbsp    finely chopped rosemary', '1 tbsp  finely chopped sage, plus 4 whole leaves', '100g soft white  breadcrumbs', '2 tbsp pomegranate molasses (see tip below)', '40g  chopped walnuts or pecans', '40g dried cranberries', 'grating of nutmeg', '2 x 320g sheets dairy-free puff pastry', 'plain flour, to dust', '3 tbsp plant-based milk', '1 tbsp  English mustard or Dijon mustard with a pinch of turmeric']	Easy	['Freezable', 'Dairy-free', 'Egg-free', 'Vegan', 'Vegetarian']
	['dinner', 'lunch', 'main-course', 'starter', 'supper']	Smoked mackerel, courgette & butter bean salad	['1 red chilli, finely chopped (deseeded if you don’t like it very hot)', '1 lemon, zested and juiced', '2 smoked mackerel fillets, skin removed and broken into large flakes', '1 large courgette, cut into ribbons using a vegetable peeler', '400g can butter beans, drained and rinsed', '3 tbsp extra virgin olive oil, plus extra for drizzling', '1 small pack parsley, roughly chopped', '50g feta, broken into large pieces']	Easy	['Gluten-free']
['asian', 'vietnamese']	['dinner', 'main-course']	Beef pho	"['1l low salt beef stock', '1 large onion, peeled and cut into quarters ', 'large thumb-sized piece ginger, peeled', '1 cinnamon stick', '2 star anise', '1 tsp coriander seeds', '½ tsp cloves', '230g sirloin steak', '1 tsp palm sugar', '1 tbsp fish sauce', '1 ½ tbsp soy sauce', '200g flat rice noodles', '2 spring onions, shredded', ""1 small red (bird's-eye) chilli, finely sliced "", 'handful each of Thai basil and coriander', '1 lime, cut into wedges ']"	Easy	[]
	['dinner', 'main-course']	Sausage, mustard & apple hash	['450g white potatoes, peeled and cut into 2cm cubes', '30g butter', 'olive oil, for frying', '2 small Cox’s apples, cored and cut into wedges', '4 herby pork sausages, cut into chunks', '2 tsp wholegrain mustard', '3 thyme sprigs, leaves picked', 'watercress salad, to serve']	Easy	['Gluten-free', 'Healthy']
['british']	['dinner', 'main-course']	Creamy tarragon chicken with asparagus	['500g baby new potato, halved', '4 skinless chicken breasts', '1 tbsp sunflower oil', '1 large onion, chopped', '2 garlic cloves, crushed', '350ml chicken stock', 'small bunch tarragon', '175g asparagus, trimmed', '3 tbsp reduced-fat crème fraîche']	Easy	[]
	['dinner']	Make-ahead hearty hotpot	['2 tbsp olive oil', '2 onions, chopped', '2 carrots, chopped', '150g chestnut mushrooms, quartered', '1 tbsp tomato purée', '350g mixed root veg, peeled and chopped into 2cm pieces (we used parsnip, celeriac and swede)', 'small bunch of thyme, leaves picked', '100g pearl barley', '1 vegetable stock cube', '2 bay leaves', '1 tbsp soy sauce', '2 tsp Dijon mustard', '1 tbsp balsamic vinegar', '2 medium potatoes, peeled', '2 beetroot, peeled', '2 medium sweet potatoes, peeled', '25g butter', '2 tsp honey']	Easy	['Freezable', 'Low calorie']
['british']	['lunch', 'main-course']	Pea, feta & summer herb frittata	['300g new potato (such as Jersey Royals), halved if large', '4 eggs and 2 egg whites', 'splash of  milk', '1 garlic clove, crushed', '1 tbsp gluten-free  wholegrain mustard', 'handful mixed soft herbs, such as dill, mint and parsley, roughly chopped', '3 tbsp cream cheese', '1 tbsp olive oil', '1 courgette, coarsely grated', '½ tsp chilli flakes', '140g petits pois (defrosted if frozen)', '100g feta cheese, crumbled', '50g sundried tomato, drained and roughly chopped', '100g bag  salad leaves, to serve']	Easy	['Gluten-free', 'Vegetarian']
	['afternoon-tea']	Chorizo & manchego scones	['225g self-raising flour, plus extra for dusting', '¼ tsp salt', '50g butter, very cold, diced', '60g chorizo', '110g manchego', 'pinch of smoked paprika', '150ml buttermilk (or milk)']	Easy	[]
		Crab apple jelly	['1½ kg crab apples', '1 lemon, zest pared and half juiced', 'around 450g white caster or granulated sugar', 'Jelly bag']	Easy	['Easily doubled', 'Easily halved', 'Dairy-free', 'Egg-free', 'Gluten-free', 'Vegetarian']
['greek']	['dinner', 'lunch', 'main-course']	Minty roast veg & hummus salad	['4 parsnips, peeled and cut into wedges', '4 carrots, cut into wedges', '2 tsp cumin seeds', '400g can chickpeas, drained', '2 tbsp vegetable oil', '500g pack cooked beetroot (not in vinegar), drained and cut into wedges', '2 tbsp clear honey', '200g pot hummus', '2 tbsp white wine vinegar', 'small bunch mint, leaves picked', '200g block Greek-style salad cheese or feta']	Easy	['Vegetarian']
['scottish']	['afternoon-tea', 'dessert']	Dundee cake	['100g blanched almonds', '180g unsalted butter, at room temperature', '180g light muscovado sugar', 'zest 1 large orange', '3 tbsp apricot jam or marmalade', '225g plain flour', '1 tsp baking powder', '3 large  eggs, beaten', '100g ground almonds', '2 tbsp milk', '500g mixed dried fruit', '100g whole glacé cherry', '1 tbsp milk', '2 tsp caster sugar']	Easy	[]
['british']	['breakfast', 'brunch']	Ham, mushroom & spinach frittata	['1 tsp oil', '80g chestnut mushrooms, sliced', '50g ham, diced', '80g bag spinach', '4 medium eggs, beaten', '1 tbsp grated cheddar']	Easy	['Gluten-free', 'Keto']
	['dinner']	Chicken bake with garlic croutons	['4 skinless chicken breasts', '2 tbsp olive oil', '200g passata', '250g cherry tomatoes', '125g ball reduced-fat mozzarella, drained and sliced', '3 thick slices of sourdough or bloomer, cut into 2cm cubes', '2 garlic cloves, crushed', 'pinch of dried oregano', '½ small bunch of basil, leaves picked', 'green salad, to serve']	Easy	[]
['scottish']	['afternoon-tea', 'snack', 'treat']	Double chocolate shortbreads	['175g butter, softened', '85g golden caster sugar', '200g plain flour', '2 tbsp cocoa powder', '100g chocolate chips, milk or dark']	Easy	[]
	['dinner', 'main-course']	Sausage, mustard & apple hash	['450g white potatoes, peeled and cut into 2cm cubes', '30g butter', 'olive oil, for frying', '2 small Cox’s apples, cored and cut into wedges', '4 herby pork sausages, cut into chunks', '2 tsp wholegrain mustard', '3 thyme sprigs, leaves picked', 'watercress salad, to serve']	Easy	['Gluten-free', 'Healthy']
	['dinner', 'lunch', 'main-course', 'supper']	Green masala butternut squash curry	['40g coriander', '20g mint, stems removed', '2 green chillies, sliced', '4 garlic cloves', '2cm ginger, peeled', '400ml can coconut milk', '1 tsp garam masala', '1 tsp ground turmeric', '500g butternut squash, peeled and cut into even-sized pieces', '150g green beans, ends trimmed', 'cooked basmati rice', 'extra coriander, to serve', 'mango chutney, to serve']	Easy	['Gluten-free', 'Vegan', 'Vegetarian']
['english']		Puy lentil, spiced roast carrot & feta salad	"['2 tbsp olive oil', '1 tbsp cumin seeds', '500g carrots, peeled, halved and cut into batons', '1 tbsp clear honey', '250g pouch cooked Puy lentils  (or canned, drained and rinsed)', '1 red onion, finely sliced', '½  lemon, juiced', 'large handful mint  leaves, roughly chopped', ""100g lamb's lettuce"", '85g feta cheese, crumbled']"	Easy	['Healthy', 'Vegetarian']
	['dinner']	Rosemary balsamic lamb with vegetable mash	['320g celeriac, peeled and diced', '320g swede, peeled and diced', '320g potato, peeled and diced', '1 tbsp rapeseed oil', '3 red onions, thinly sliced', '550g lean, trimmed lamb steak, diced', '1 tsp finely chopped rosemary', '1 tbsp vegetable bouillon powder', '2 tbsp balsamic vinegar', '1 tbsp chopped parsley', '320g spinach, to serve', '320g frozen peas, to serve']	Easy	['Gluten-free', 'Healthy']
['british']	['dessert', 'treat']	Easter egg brownies	['185g unsalted butter, cut into small chunks, plus extra for greasing', '185g best dark chocolate, broken into pieces', '3 large eggs', '275g golden caster sugar', '85g plain flour', '40g cocoa powder', '5 fondant filled eggs', '150g mini chocolate eggs', 'You will also need a few fluffy chenille Easter chick to decorate (optional)']	Easy	[]
['italian']	['dinner', 'lunch', 'main-course', 'pasta']	Butternut & bacon fusilli	['½ x 160g pack pancetta di cubetti', '1 ½ tbsp olive oil', '750g butternut squash, deseeded and cut into 2cm cubes', '2 rosemary sprigs, leaves finely chopped', '¼ tsp chilli flakes', '3 garlic cloves, finely chopped', '350g fusilli bucati (or fusilli)', '100g young leaf spinach, roughly chopped', 'grated parmesan, to serve']	Easy	['Healthy']
	['dinner', 'main-course']	Slow cooker beef topside with red wine gravy	['1 tbsp black peppercorns', '1 tbsp English mustard powder', '2 tbsp chopped  rosemary', '1 tsp celery seeds', '15g dried porcini mushrooms', '4 tbsp olive or rapeseed oil', '1.6kg beef topside, cut into 12 slices', '600ml hot beef stock', '1 large  carrot, peeled and roughly chopped', '1 large onion, roughly chopped', '2 sticks celery, roughly chopped', '2 tbsp tomato purée', '200ml red wine', '1 tbsp cornflour (optional)']	Easy	['Freezable']
['indian']	['dinner', 'side-dish']	Lentil & tomato salad	['250g dried Puy or green lentil, rinsed', 'juice ½  lime and juice ½ lemon', '1 tbsp white wine or  cider vinegar', '1 red onion, thinly sliced into rings', '2 tbsp extra-virgin olive oil', '1 tsp ground cumin', '1 small  garlic clove, crushed', '2 tbsp mango chutney', 'handful coriander, roughly chopped', '250g cherry vine tomato, halved', '85g baby spinach, washed and thoroughly dried']	Easy	['Healthy', 'Vegetarian']
	['dinner', 'main-course']	One-pan roast butter chicken	['1 lemon, halved', '1 medium chicken', '100g soft unsalted butter', '2 garlic cloves, crushed', 'small piece ginger, finely grated', '1 tsp garam masala', '1 tsp turmeric', '1 tsp ground cloves', 'handful coriander leaves, chopped', '3 garlic cloves, finely grated', 'small piece ginger, finely grated', '4 cardamom pods', '4 cloves', '1 tsp fennel seeds', '2 tsp garam masala', '1 tsp hot chilli powder', '2 tsp turmeric', '500ml passata', '200ml double cream']	Easy	['Gluten-free']
		Challah	['500g strong white bread flour, plus extra for dusting ', '70g caster sugar', '7g sachet fast-action dried yeast', '2 eggs, beaten', '70ml sunflower oil, plus extra for the bowl', '1 tbsp poppy seeds or sesame seeds (optional)']	More effort	['Vegetarian']
['british']	['dinner', 'main-course', 'pasta']	Roasted cauliflower & hazelnut carbonara	['1 large cauliflower (about 700g), cut into small florets', '1 tbsp olive oil', 'small bunch thyme, leaves picked', '100g hazelnuts, roughly chopped', '350g penne', '100g parmesan (or vegetarian alternative), grated', '2 eggs, beaten', '2 tbsp double cream', 'small pack parsley, chopped']	Easy	['Vegetarian']
