cuisine	types	name	ingredients	difficulty	health_banners
	['dinner', 'main-course', 'supper']	Steak & blue cheese pie	['400g plain flour', '1 tbsp English mustard powder', '100g lard', '100g butter', '2 eggs, beaten (1 for the pastry and 1 for egg wash)', '1kg braising steak such as brisket or skirt, cut into chunks, any sinew and fatty bits discarded', '50g plain flour', '1 tbsp English mustard powder', '3 tbsp rapeseed oil or vegetable oil', '250g bacon lardons', '2 carrots, cut into small chunks', '2 onions, chopped', '2 bay leaves', '1 tbsp Worcestershire sauce', '1 tbsp tomato purée', '600ml beef stock', '6 thyme sprigs', '150g strong crumbly blue cheese, such as stilton', '1 piece marrowbone, about 10cm depending on the depth of your pie dish (optional)']	More effort	['Freezable']
['chinese']	['dinner']	Kung pao cauliflower & prawn stir-fry	['¼ cauliflower, broken into florets', '1 tbsp vegetable oil', '1 garlic clove, finely sliced', '½ red chilli, finely sliced', 'thumb-sized piece of ginger, finely grated', '60g raw king prawns', '1 tbsp rice vinegar', '2 tbsp hoisin sauce', '3 spring onions, shredded', '15g peanuts, roughly chopped', 'cooked brown rice, to serve']	Easy	[]
	['dinner', 'lunch', 'main-course', 'supper']	Squash, winter herb & crispy butter bean pie	['250g plain spelt flour, plus a little extra for dusting', '125g cold unsalted butter, cubed', 'a few sprigs each of rosemary and thyme, leaves picked and finely chopped', '1 lemon, zested', '25g mature cheddar, grated', '1 medium egg yolk', '700g butternut squash, peeled and cut into 2cm cubes', '2 tbsp olive oil', '3 bulbs of garlic, cloves separated and peeled', '1 tsp balsamic vinegar', '1 tbsp runny honey', '2 sprigs each of rosemary and thyme, leaves picked and finely chopped, plus extra to serve', '220g lancashire cheese or mature cheddar, crumbled or cut into cubes', '150g crème fraîche', '½ lemon, juiced', '1 tbsp wholegrain mustard', 'small bunch of parsley, finely chopped', 'dash of vegetarian Worcestershire sauce (optional)', '2 large eggs, beaten', '2 x 400g cans butter beans, rinsed and drained', 'a drizzle of olive oil', '1 lemon, zested', '2 sage sprigs, leaves picked and finely chopped, plus extra to serve']	More effort	['Vegetarian']
	['dinner', 'lunch', 'main-course']	Halloumi burgers	['250g block halloumi cheese, cut into 8 thick slices', '1 tbsp olive oil', '4 brioche buns', '4 tbsp hummus', '1 large ripe tomato, thinly sliced', '4 Butterhead lettuce leaves', '4 tbsp fresh tomato salsa (most supermarkets stock a version)']	Easy	['Vegetarian']
	['lunch']	Mango salad with avocado and black beans	['1 lime, zested and juiced', '1 small mango, stoned, peeled and chopped', '1 small avocado, stoned, peeled and chopped', '100g cherry tomatoes, halved', '1 red chilli, deseeded and chopped', '1 red onion, chopped', '½ small pack coriander, chopped', '400g can black beans, drained and rinsed']	Easy	['Gluten-free', 'Healthy', 'Vegan', 'Vegetarian']
	['lunch', 'snack']	Easy egg muffins	['1 tbsp oil', '150g broccoli, finely chopped', '1 red pepper, finely chopped ', '2 spring onions, sliced ', '6 large eggs', '1 tbsp milk', 'large pinch of smoked paprika', '50g cheddar or gruyère, grated ', 'small handful of  chives, chopped (optional)']	Easy	['Gluten-free', 'Vegetarian']
['mexican']	['main-course']	Healthy chilli con carne	['1-2 tbsp olive oil, plus extra if needed', '400g diced stewing beef', '1 onion, finely chopped', '2 garlic cloves, finely chopped', '1 ½ tsp ground cumin', '1-2 tbsp chipotle paste (or gluten-free alternative), depending on how spicy you like it', '400g can kidney bean in chilli sauce', '400g can chopped tomato', '1 lime, zested and cut into wedges', '¼ small pack coriander, leaves only', 'cooked rice, to serve (optional)']	Easy	['Freezable', 'Gluten-free', 'Healthy']
	['dinner', 'main-course']	Slow cooker pork shoulder	['2 tbsp olive oil', '1.5kg piece pork shoulder', '250ml white wine', '250ml chicken stock', '4 bay leaves', '2 sprigs of rosemary', '1 tsp black peppercorns', '1 garlic bulb']	Easy	['Freezable']
['british']	['dinner', 'main-course']	Pulled firecracker brisket	['3 tbsp vegetable oil', '2-2½kg piece beef brisket, rolled (ask the butcher to do this for you)', '2 red onions, chopped', '1 tbsp sweet smoked paprika', '1 tbsp English mustard powder', '2 tsp ground cinnamon', '½ tsp ground cayenne pepper or 1 tsp chilli flakes (omit if you want to reduce heat)', '1½ tbsp treacle', '50ml red wine vinegar, plus 2 tbsp', '75g soft light brown sugar, plus 2 tbsp', '3 garlic cloves, crushed', '4-6 bay leaves', '2-4 fat red chillies, pierced a few times with a small sharp knife', '500ml carton passata', '2 tbsp Worcestershire sauce', 'soured cream, to serve']	Easy	['Freezable']
['asian']	['dinner', 'main-course', 'supper']	Aubergine & pork hotpot	['3 tbsp sunflower oil', '750g fatty  pork, such as shoulder or skinless belly, cut into large chunks', '2 aubergines, cut into large chunks', '2 tbsp dark muscovado sugar', '5 star anise', '1 cinnamon stick', '2 onions, chopped', 'very large knob fresh  root ginger, peeled and finely sliced', '1 red chilli, deseeded and sliced', '1 bunch coriander, leaves and stalks separated, stalks finely chopped', '2 tbsp Thai fish sauce', 'juice 1 large   lime']	More effort	['Easily halved', 'Freezable']
['cajun-creole']	['dinner', 'main-course', 'snack', 'supper']	Cajun chicken burgers	['4 skinless chicken breasts', '2 tbsp olive oil', '4 rashers smoked bacon', '2 avocados', '4 ciabatta rolls, split', '4 thin slices of your favourite cheese', '4 small handfuls baby spinach leaves', 'mayonnaise, to serve (optional)', '1 tbsp ground cumin', '1 tbsp ground coriander', '1 tbsp paprika']	Easy	[]
['spanish']	['dinner', 'main-course']	Easy paella	['1 tbsp olive oil', '1 onion, chopped', '1 tsp each hot smoked paprika and dried thyme', '300g paella or risotto rice', '3 tbsp dry sherry or white wine (optional)', '400g can chopped tomatoes with garlic', '900ml chicken stock', '400g frozen seafood mix, defrosted', '1 lemon,  ½ juiced, ½ cut into wedges', 'handful of flat-leaf parsley, roughly chopped']	Easy	[]
['french']	['dinner', 'lunch', 'main-course']	Flambéed chicken with asparagus	['4 boneless, skinless chicken breasts', '1 tbsp seasoned plain flour', '2 tbsp olive oil', 'knob of butter', '4 shallots, finely chopped', '4 tbsp brandy or cognac', '300ml chicken stock', '16 asparagus spears, halved', '4rounded tbsp crème fraîche', '1 tbsp chopped tarragon']	A challenge	[]
['italian']	['dinner', 'lunch', 'pasta', 'supper']	Chunky Bolognese soup with penne	['2 tsp rapeseed oil', '3 onions, finely chopped', '3 large carrots, finely diced', '2 celery sticks, finely diced', '3 garlic cloves, finely chopped', '250g pack 5% fat steak mince', '500g carton passata', '1 tbsp vegetable bouillon powder', '1 tsp smoked paprika', '4 sprigs fresh thyme', '100g wholemeal penne', '45g finely grated parmesan, plus extra to serve']	Easy	['Healthy', 'High-protein', 'Low calorie']
	['dessert']	Raspberry & dark chocolate cheat's ice cream terrine	['225g raspberries', '1 tbsp caster sugar', '½  lemon, juiced', '400ml double cream', '1 tbsp vanilla paste', '275g condensed milk', '200g dark chocolate, melted and cooled slightly, plus extra for topping']	Easy	['Freezable', 'Vegetarian']
	['dinner']	Roast broccoli & sesame ramen noodle bowls	['1⁄2 head of broccoli, broken into florets', '1 tbsp sesame oil', '1 tbsp sesame seeds, plus extra to serve', '2 eggs', '200g ramen or dried egg noodles', '2 spring onions, sliced', '2 radishes, thinly sliced', 'crispy chilli oil, to serve (optional)', '3 tbsp sesame oil', '1 tbsp brown miso', 'pinch of chilli flakes', '2 tsp brown sugar', '1-2 limes, juiced (to taste)', '1 small garlic clove, crushed']	Easy	['Vegetarian']
	['dinner', 'main-course', 'supper']	Tuna & sundried tomato pasta bake	['500g dried rigatoni (or any other short pasta)', '2 x 400g cans chopped tomatoes', '4 thyme sprigs, leaves only', '300ml double cream', '280g jar sundried tomatoes, drained and quartered', '198g can  no-added-salt sweetcorn, drained', '3 x 120g cans tuna in spring water, drained', '100g cheddar, grated', '50g parmesan, grated']	Easy	['Freezable']
['mexican']	['side-dish']	Mexican rice	['1 tbsp sunflower oil', '1 onion, finely chopped', '2 garlic cloves, minced ', '250g long grain rice', '1 tsp chipotle paste, optional (more if you want it spicier)', '1 tbsp tomato purée', '1 x 400g tin chopped tomatoes', '750ml hot chicken or vegetable stock', 'small bunch of coriander, finely chopped ']	Easy	[]
['british']	['dinner', 'main-course']	Chestnut, spinach & blue cheese en croûte	['50g butter', '500g pack leeks, thickly sliced', '3 garlic cloves, thinly sliced', '240g bag baby spinach', '415g can chestnut purée', '3 large eggs, plus 1 for glazing', '½ nutmeg, finely grated', '200g pack vacuum-packed whole cooked chestnuts, halved', '85g fresh white breadcrumbs', '220g pack blue Shropshire cheese, rind trimmed, diced', '500g pack all-butter puff pastry', '500ml vegetable stock', '2 leeks, thinly sliced', '1 tbsp cornflour', '300ml pot double cream']	More effort	['Vegetarian']
['british']	['treat']	Romantic rose cupcakes	['150ml pot  natural yogurt', '3 eggs, beaten', '1 tsp vanilla extract', '175g golden caster sugar', '140g self-raising flour', '1 tsp baking powder', '100g ground almond', '175g unsalted butter, melted  ', '100g white chocolate', '140g unsalted butter', '140g icing sugar']	Easy	['Easily doubled', 'Easily halved', 'Freezable (un-iced)', 'Vegetarian']
['british']	['dinner', 'main-course', 'supper']	Creamy chicken & asparagus braise	['1 tbsp rapeseed oil', '2 skinless chicken breasts (about 150g each)', '10 medium asparagus spears, each cut into 3', '1 large or 2 small leeks, well washed and thickly sliced', '3 celery sticks, sliced', '200ml reduced-salt vegetable bouillon', '140g frozen peas', '1 egg yolk', '4 tbsp natural bio yogurt', '1 garlic clove, finely grated', '⅓ small pack fresh tarragon, chopped', 'new potatoes, to serve (optional)']	Easy	['Healthy']
['british']	['afternoon-tea', 'condiment']	Rhubarb & ginger jam	['1kg pink rhubarb, trimmed weight', '1kg jam sugar (which has added pectin)', 'zest and juice 1 lemon', '50g stem or crystallised ginger, finely chopped', '4cm piece ginger, peeled']	More effort	[]
	['afternoon-tea', 'dessert', 'treat']	Easy vanilla cupcakes	['110g butter, softened', '110g golden caster sugar', '2 eggs', '1 tsp vanilla extract', '110g self-raising flour', '1-2 tbsp milk, plus a little extra for the icing', '125g butter, softened', '185g icing sugar']	Easy	['Vegetarian']
['british']	['lunch', 'soup']	Creamy tomato soup	['3 tbsp olive oil', '2 onions, chopped', '2 celery sticks, chopped', '300g carrot, chopped', '500g potato, diced', '4 bay leaves', '5 tbsp tomato purée', '2 tbsp sugar', '2 tbsp red or white wine vinegar', '4 x 400g cans chopped tomatoes', '500g passata', '3 vegetable stock cubes', '400ml whole milk']	Easy	['Freezable', 'Healthy', 'Vegetarian']
['british']	['dinner', 'lunch', 'main-course', 'supper']	Masala frittata with avocado salsa	['2 tbsp olive oil', '3 onions, 2½ thinly sliced, ½ finely chopped', '1 tbsp Madras curry paste', '500g cherry tomatoes, halved', '1 red chilli, deseeded and finely chopped', 'small pack coriander, roughly chopped', '8 large eggs, beaten', '1 avocado, stoned, peeled and cubed', 'juice 1 lemon']	Easy	['Healthy', 'Keto', 'Vegetarian']
['mediterranean']	['dinner', 'main-course']	Quinoa salad with grilled halloumi	['3 tbsp extra-virgin olive oil', '1 small red onion, sliced', '1 large roasted pepper from a jar, thickly sliced, or a handful of ready-roasted sliced peppers', '200g quinoa', '500ml vegetable stock', 'small bunch flat-leaf parsley, roughly chopped', 'zest and juice 1 lemon', 'large pinch sugar', '250g pack halloumi cheese, cut into 6 sliced']	Easy	['Gluten-free', 'Vegetarian']
	['dinner', 'lunch', 'soup', 'starter', 'supper']	Soup maker leek and potato soup	['225g potatoes, peeled and cut into 1cm pieces ', '1 small onion, cut the same size as the potatoes ', '1 large leek, sliced ', '450ml light chicken or vegetable stock', '60ml whipping cream, plus a drizzle to serve  ', '60ml whole milk', 'small knob of butter', 'finely chopped chives']	Easy	['Freezable', 'Vegetarian']
	['dinner', 'lunch', 'soup', 'starter', 'supper']	Soup maker carrot and coriander soup	['1 small onion, chopped', '½ tsp ground coriander', '1 small potato, peeled and chopped ', '400g carrots, peeled and chopped ', '600ml vegetable or chicken stock', '½ small bunch coriander']	Easy	['Freezable', 'Vegetarian']
['mexican']	['dinner', 'main-course']	Black bean chilli	['2 tbsp olive oil', '4 garlic cloves, finely chopped', '2 large onions, chopped', '3 tbsp sweet pimenton (Spanish paprika) or mild chilli powder', '3 tbsp ground cumin', '3 tbsp cider vinegar', '2 tbsp brown sugar', '2 x 400g (2 x 14oz) cans  chopped tomatoes', '2 x 400g (2 x 14oz)  cans black beans, rinsed and drained', 'a few, or one, of the following to serve: crumbled  feta cheese (or a dairy-free alternative), chopped spring onions, sliced radishes, avocado chunks, soured cream']	Easy	['Freezable', 'Dairy-free', 'Healthy', 'Low calorie', 'Vegan', 'Vegetarian']
	['dinner', 'main-course', 'supper']	Steak & blue cheese pie	['400g plain flour', '1 tbsp English mustard powder', '100g lard', '100g butter', '2 eggs, beaten (1 for the pastry and 1 for egg wash)', '1kg braising steak such as brisket or skirt, cut into chunks, any sinew and fatty bits discarded', '50g plain flour', '1 tbsp English mustard powder', '3 tbsp rapeseed oil or vegetable oil', '250g bacon lardons', '2 carrots, cut into small chunks', '2 onions, chopped', '2 bay leaves', '1 tbsp Worcestershire sauce', '1 tbsp tomato purée', '600ml beef stock', '6 thyme sprigs', '150g strong crumbly blue cheese, such as stilton', '1 piece marrowbone, about 10cm depending on the depth of your pie dish (optional)']	More effort	['Freezable']
['chinese']	['dinner']	Kung pao cauliflower & prawn stir-fry	['¼ cauliflower, broken into florets', '1 tbsp vegetable oil', '1 garlic clove, finely sliced', '½ red chilli, finely sliced', 'thumb-sized piece of ginger, finely grated', '60g raw king prawns', '1 tbsp rice vinegar', '2 tbsp hoisin sauce', '3 spring onions, shredded', '15g peanuts, roughly chopped', 'cooked brown rice, to serve']	Easy	[]
	['dinner', 'lunch', 'main-course', 'supper']	Squash, winter herb & crispy butter bean pie	['250g plain spelt flour, plus a little extra for dusting', '125g cold unsalted butter, cubed', 'a few sprigs each of rosemary and thyme, leaves picked and finely chopped', '1 lemon, zested', '25g mature cheddar, grated', '1 medium egg yolk', '700g butternut squash, peeled and cut into 2cm cubes', '2 tbsp olive oil', '3 bulbs of garlic, cloves separated and peeled', '1 tsp balsamic vinegar', '1 tbsp runny honey', '2 sprigs each of rosemary and thyme, leaves picked and finely chopped, plus extra to serve', '220g lancashire cheese or mature cheddar, crumbled or cut into cubes', '150g crème fraîche', '½ lemon, juiced', '1 tbsp wholegrain mustard', 'small bunch of parsley, finely chopped', 'dash of vegetarian Worcestershire sauce (optional)', '2 large eggs, beaten', '2 x 400g cans butter beans, rinsed and drained', 'a drizzle of olive oil', '1 lemon, zested', '2 sage sprigs, leaves picked and finely chopped, plus extra to serve']	More effort	['Vegetarian']
	['dinner', 'lunch', 'main-course']	Halloumi burgers	['250g block halloumi cheese, cut into 8 thick slices', '1 tbsp olive oil', '4 brioche buns', '4 tbsp hummus', '1 large ripe tomato, thinly sliced', '4 Butterhead lettuce leaves', '4 tbsp fresh tomato salsa (most supermarkets stock a version)']	Easy	['Vegetarian']
	['lunch']	Mango salad with avocado and black beans	['1 lime, zested and juiced', '1 small mango, stoned, peeled and chopped', '1 small avocado, stoned, peeled and chopped', '100g cherry tomatoes, halved', '1 red chilli, deseeded and chopped', '1 red onion, chopped', '½ small pack coriander, chopped', '400g can black beans, drained and rinsed']	Easy	['Gluten-free', 'Healthy', 'Vegan', 'Vegetarian']
	['lunch', 'snack']	Easy egg muffins	['1 tbsp oil', '150g broccoli, finely chopped', '1 red pepper, finely chopped ', '2 spring onions, sliced ', '6 large eggs', '1 tbsp milk', 'large pinch of smoked paprika', '50g cheddar or gruyère, grated ', 'small handful of  chives, chopped (optional)']	Easy	['Gluten-free', 'Vegetarian']
['mexican']	['main-course']	Healthy chilli con carne	['1-2 tbsp olive oil, plus extra if needed', '400g diced stewing beef', '1 onion, finely chopped', '2 garlic cloves, finely chopped', '1 ½ tsp ground cumin', '1-2 tbsp chipotle paste (or gluten-free alternative), depending on how spicy you like it', '400g can kidney bean in chilli sauce', '400g can chopped tomato', '1 lime, zested and cut into wedges', '¼ small pack coriander, leaves only', 'cooked rice, to serve (optional)']	Easy	['Freezable', 'Gluten-free', 'Healthy']
	['dinner', 'main-course']	Slow cooker pork shoulder	['2 tbsp olive oil', '1.5kg piece pork shoulder', '250ml white wine', '250ml chicken stock', '4 bay leaves', '2 sprigs of rosemary', '1 tsp black peppercorns', '1 garlic bulb']	Easy	['Freezable']
['british']	['dinner', 'main-course']	Pulled firecracker brisket	['3 tbsp vegetable oil', '2-2½kg piece beef brisket, rolled (ask the butcher to do this for you)', '2 red onions, chopped', '1 tbsp sweet smoked paprika', '1 tbsp English mustard powder', '2 tsp ground cinnamon', '½ tsp ground cayenne pepper or 1 tsp chilli flakes (omit if you want to reduce heat)', '1½ tbsp treacle', '50ml red wine vinegar, plus 2 tbsp', '75g soft light brown sugar, plus 2 tbsp', '3 garlic cloves, crushed', '4-6 bay leaves', '2-4 fat red chillies, pierced a few times with a small sharp knife', '500ml carton passata', '2 tbsp Worcestershire sauce', 'soured cream, to serve']	Easy	['Freezable']
['asian']	['dinner', 'main-course', 'supper']	Aubergine & pork hotpot	['3 tbsp sunflower oil', '750g fatty  pork, such as shoulder or skinless belly, cut into large chunks', '2 aubergines, cut into large chunks', '2 tbsp dark muscovado sugar', '5 star anise', '1 cinnamon stick', '2 onions, chopped', 'very large knob fresh  root ginger, peeled and finely sliced', '1 red chilli, deseeded and sliced', '1 bunch coriander, leaves and stalks separated, stalks finely chopped', '2 tbsp Thai fish sauce', 'juice 1 large   lime']	More effort	['Easily halved', 'Freezable']
['cajun-creole']	['dinner', 'main-course', 'snack', 'supper']	Cajun chicken burgers	['4 skinless chicken breasts', '2 tbsp olive oil', '4 rashers smoked bacon', '2 avocados', '4 ciabatta rolls, split', '4 thin slices of your favourite cheese', '4 small handfuls baby spinach leaves', 'mayonnaise, to serve (optional)', '1 tbsp ground cumin', '1 tbsp ground coriander', '1 tbsp paprika']	Easy	[]
['spanish']	['dinner', 'main-course']	Easy paella	['1 tbsp olive oil', '1 onion, chopped', '1 tsp each hot smoked paprika and dried thyme', '300g paella or risotto rice', '3 tbsp dry sherry or white wine (optional)', '400g can chopped tomatoes with garlic', '900ml chicken stock', '400g frozen seafood mix, defrosted', '1 lemon,  ½ juiced, ½ cut into wedges', 'handful of flat-leaf parsley, roughly chopped']	Easy	[]
['french']	['dinner', 'lunch', 'main-course']	Flambéed chicken with asparagus	['4 boneless, skinless chicken breasts', '1 tbsp seasoned plain flour', '2 tbsp olive oil', 'knob of butter', '4 shallots, finely chopped', '4 tbsp brandy or cognac', '300ml chicken stock', '16 asparagus spears, halved', '4rounded tbsp crème fraîche', '1 tbsp chopped tarragon']	A challenge	[]
['italian']	['dinner', 'lunch', 'pasta', 'supper']	Chunky Bolognese soup with penne	['2 tsp rapeseed oil', '3 onions, finely chopped', '3 large carrots, finely diced', '2 celery sticks, finely diced', '3 garlic cloves, finely chopped', '250g pack 5% fat steak mince', '500g carton passata', '1 tbsp vegetable bouillon powder', '1 tsp smoked paprika', '4 sprigs fresh thyme', '100g wholemeal penne', '45g finely grated parmesan, plus extra to serve']	Easy	['Healthy', 'High-protein', 'Low calorie']
	['dessert']	Raspberry & dark chocolate cheat's ice cream terrine	['225g raspberries', '1 tbsp caster sugar', '½  lemon, juiced', '400ml double cream', '1 tbsp vanilla paste', '275g condensed milk', '200g dark chocolate, melted and cooled slightly, plus extra for topping']	Easy	['Freezable', 'Vegetarian']
	['dinner']	Roast broccoli & sesame ramen noodle bowls	['1⁄2 head of broccoli, broken into florets', '1 tbsp sesame oil', '1 tbsp sesame seeds, plus extra to serve', '2 eggs', '200g ramen or dried egg noodles', '2 spring onions, sliced', '2 radishes, thinly sliced', 'crispy chilli oil, to serve (optional)', '3 tbsp sesame oil', '1 tbsp brown miso', 'pinch of chilli flakes', '2 tsp brown sugar', '1-2 limes, juiced (to taste)', '1 small garlic clove, crushed']	Easy	['Vegetarian']
	['dinner', 'main-course', 'supper']	Tuna & sundried tomato pasta bake	['500g dried rigatoni (or any other short pasta)', '2 x 400g cans chopped tomatoes', '4 thyme sprigs, leaves only', '300ml double cream', '280g jar sundried tomatoes, drained and quartered', '198g can  no-added-salt sweetcorn, drained', '3 x 120g cans tuna in spring water, drained', '100g cheddar, grated', '50g parmesan, grated']	Easy	['Freezable']
['mexican']	['side-dish']	Mexican rice	['1 tbsp sunflower oil', '1 onion, finely chopped', '2 garlic cloves, minced ', '250g long grain rice', '1 tsp chipotle paste, optional (more if you want it spicier)', '1 tbsp tomato purée', '1 x 400g tin chopped tomatoes', '750ml hot chicken or vegetable stock', 'small bunch of coriander, finely chopped ']	Easy	[]
['british']	['dinner', 'main-course']	Chestnut, spinach & blue cheese en croûte	['50g butter', '500g pack leeks, thickly sliced', '3 garlic cloves, thinly sliced', '240g bag baby spinach', '415g can chestnut purée', '3 large eggs, plus 1 for glazing', '½ nutmeg, finely grated', '200g pack vacuum-packed whole cooked chestnuts, halved', '85g fresh white breadcrumbs', '220g pack blue Shropshire cheese, rind trimmed, diced', '500g pack all-butter puff pastry', '500ml vegetable stock', '2 leeks, thinly sliced', '1 tbsp cornflour', '300ml pot double cream']	More effort	['Vegetarian']
['british']	['treat']	Romantic rose cupcakes	['150ml pot  natural yogurt', '3 eggs, beaten', '1 tsp vanilla extract', '175g golden caster sugar', '140g self-raising flour', '1 tsp baking powder', '100g ground almond', '175g unsalted butter, melted  ', '100g white chocolate', '140g unsalted butter', '140g icing sugar']	Easy	['Easily doubled', 'Easily halved', 'Freezable (un-iced)', 'Vegetarian']
['british']	['dinner', 'main-course', 'supper']	Creamy chicken & asparagus braise	['1 tbsp rapeseed oil', '2 skinless chicken breasts (about 150g each)', '10 medium asparagus spears, each cut into 3', '1 large or 2 small leeks, well washed and thickly sliced', '3 celery sticks, sliced', '200ml reduced-salt vegetable bouillon', '140g frozen peas', '1 egg yolk', '4 tbsp natural bio yogurt', '1 garlic clove, finely grated', '⅓ small pack fresh tarragon, chopped', 'new potatoes, to serve (optional)']	Easy	['Healthy']
['british']	['afternoon-tea', 'condiment']	Rhubarb & ginger jam	['1kg pink rhubarb, trimmed weight', '1kg jam sugar (which has added pectin)', 'zest and juice 1 lemon', '50g stem or crystallised ginger, finely chopped', '4cm piece ginger, peeled']	More effort	[]
	['afternoon-tea', 'dessert', 'treat']	Easy vanilla cupcakes	['110g butter, softened', '110g golden caster sugar', '2 eggs', '1 tsp vanilla extract', '110g self-raising flour', '1-2 tbsp milk, plus a little extra for the icing', '125g butter, softened', '185g icing sugar']	Easy	['Vegetarian']
	['dinner']	Green burgers	['2 tbsp olive oil', '2 onions, finely chopped', '250g bag spinach', '5 slices white bread, blitzed into breadcrumbs (or 150g dried breadcrumbs)', 'good grating of fresh nutmeg', '100g mature cheddar, grated', '40g parmesan, finely grated', '1-2 large eggs, beaten', '3 tbsp plain flour', '6 crusty bread rolls', '4 ripe, juicy tomatoes, thickly sliced', 'good-quality  ketchup or other relish', 'sweet potato fries (optional)']	Easy	['Freezable', 'Vegetarian']
	['afternoon-tea', 'dessert', 'treat']	Vegan birthday cake	['320ml sunflower oil, plus extra for the tins', '450ml soy, almond or coconut milk (the pouring variety, not a can)', '1 tbsp apple cider vinegar', '500g light muscovado sugar', '2 tsp vanilla extract or vanilla bean paste', '260g plain soy or coconut yogurt', '450g self-raising flour', '160g cocoa powder', '1½ tsp baking powder', '1½ tsp bicarbonate of soda', '200g dairy-free dark chocolate', '400g vegan spread, at room temperature', '2 tsp vanilla extract or vanilla bean paste', '800g icing sugar, sifted', 'colourful sprinkles (make sure they are suitable for vegans)']	More effort	['Freezable (sponge only)', 'Dairy-free', 'Egg-free', 'Vegan', 'Vegetarian']
['british']	['treat']	Romantic rose cupcakes	['150ml pot  natural yogurt', '3 eggs, beaten', '1 tsp vanilla extract', '175g golden caster sugar', '140g self-raising flour', '1 tsp baking powder', '100g ground almond', '175g unsalted butter, melted  ', '100g white chocolate', '140g unsalted butter', '140g icing sugar']	Easy	['Easily doubled', 'Easily halved', 'Freezable (un-iced)', 'Vegetarian']
	['dinner', 'lunch', 'main-course']	Oven baked chicken breast	['olive oil', '4 chicken breasts, skin on or skin off', '1 lemon, ½ finely sliced', '2-4 sprigs thyme']	Easy	['Gluten-free']
['british']	['afternoon-tea', 'condiment']	Rhubarb & ginger jam	['1kg pink rhubarb, trimmed weight', '1kg jam sugar (which has added pectin)', 'zest and juice 1 lemon', '50g stem or crystallised ginger, finely chopped', '4cm piece ginger, peeled']	More effort	[]
