type	name	ingredients	difficulty	health_banners
canapes	Baked buffalo chicken wings	"['3 garlic cloves, crushed', '2 tbsp olive oil', '3 tbsp cider vinegar', '1 tbsp paprika', '1 tbsp Worcestershire sauce', '2 tsp celery salt', ""4 tbsp pepper sauce (we used Frank's hot sauce)"", '3 tbsp honey', '1 ½kg chicken wings, halved at the joint']"	Easy	[]
canapes	Caramelised mushroom tartlets	['2 tbsp olive oil', '1 onion, chopped', '1 tbsp golden caster sugar', '250g chestnut mushrooms, cleaned and thinly sliced', '1 garlic clove, crushed', '3-4 tbsp thyme leaves, finely chopped', 'butter, for spreading', '12 slices of thin sliced white sandwich bread', '100g grated gruyère or cheddar, for sprinkling']	Easy	['Vegetarian']
canapes	Red onion & chilli bhajis with mint & garlic raita	['2 red onions', '100g chickpea flour (gram flour)', '½ tsp baking powder', '2 tsp curry paste or powder', '1 red or green chilli, deseeded and finely chopped', 'vegetable oil, for frying', '150g tub natural yogurt', '2 tbsp chopped mint', '1 small garlic clove, crushed']	More effort	['Vegetarian']
canapes	Smoked salmon with beetroot & vodka crème fraîche	['200ml tub  crème fraîche', '3 tsp vodka', '2 tsp hot  horseradish  sauce', '6 slices smoked salmon', '250g pack small, cooked beetroot  (not in vinegar), thinly sliced, then shredded', 'salmon caviar  (optional)', 'few small, torn dill  sprigs ']	Easy	['Easily halved']
canapes	Whisky & nut baked camembert	['2 x 250g vegetarian camembert', '4 rosemary sprigs, torn', '4 thyme sprigs, torn', '50g mixed nuts, chopped', '2 tbsp Scotch whisky', '3 tbsp maple syrup', 'soda bread or sourdough, to serve (optional)']	Easy	['Vegetarian']
canapes	Spiced honey-glazed halloumi & fig salad	['10 fresh figs, halved', '60g honey', '2 tsp ras el hanout', '100ml olive oil', '2 x 250g blocks halloumi, thickly sliced, then halved', '2 tbsp sherry vinegar', '150g rocket', '2 x 80g packs prosciutto', '2 tbsp flaked  almonds, toasted']	Easy	['Gluten-free']
canapes	Luxury hummus	['700g chickpeas, drained', '135ml extra virgin olive oil, plus extra for drizzling', '2 garlic cloves, roughly chopped', '1 tbsp tahini', '1½ lemons, juiced', '½ tsp smoked paprika', '½ tsp sumac', '½ small pack parsley, roughly chopped', '40g pomegranate seeds', 'crudités and warm pittas, to serve']	Easy	['Vegetarian']
canapes	Ham & cheese croquetas	"['25g butter', '½ small onion, finely chopped', '50g plain flour', '250ml milk', '140g sliced smoked ham, diced', '50g mature cheddar, coarsely grated', '50g gruyère, finely grated', '1 tsp Dijon mustard', '2 tbsp double cream', '2 large eggs', '50g plain flour', '140g fine dried breadcrumbs', 'sunflower oil, for deep frying', '300g ripe tomatoes, roughly chopped', ""1 long red chilli, finely chopped (deseeded if you don't like it too hot)"", '1 small red onion, finely chopped', '4 large garlic cloves, crushed', '100g demerara sugar', '100ml red wine vinegar']"	More effort	['Freezable']
canapes	Smoked salmon rotollos	['300g cream cheese', '1 tbsp  lemon juice', '2 tbsp chopped  dill', 'generous pinch of black pepper', '4 large flour  tortillas', '350g smoked salmon', 'serve with extra  dill  and rocket leaves']	Easy	[]
canapes	Cheese & onion rolls	['1 egg, beaten', '1 tbsp nigella seeds', 'ketchup, brown sauce or hot sauce (or whatever you fancy), to serve', '300g plain flour, plus extra for dusting', '1 tsp mustard powder', 'pinch cayenne pepper', '200g block of  butter, very cold', '2 medium potatoes', '30g butter', '2 large onions, sliced', 'few thyme sprigs, leaves picked', '½ tsp English mustard', '200g vegetarian extra mature cheddar, grated', 'handful gherkins or pickled onions (or a mixture), roughly chopped']	More effort	['Vegetarian']
canapes	Mini chicken fajitas	['2 tbsp sunflower oil', '2 skinless  chicken breasts, cut into 1.5cm/1/2in chunks', '1 red pepper, deseeded and cut into 1.5cm/1/2in chunks', '1 yellow pepper, deseeded and cut into 1.5cm/1/2in chunks', '1 tsp ground cumin', '1 tsp ground coriander', '¼ tsp hot chilli powder', '227g can chopped tomatoes', '2 tbsp chipotle paste', '4 spring onions, trimmed and thinly sliced', 'large pack coriander, leaves chopped', '3 large flour tortillas', '75g ready-grated mozzarella', '1 ripe avocado, stoned and peeled', 'juice 1 large lime', '1 garlic clove, crushed', '2 heaped tbsp finely chopped coriander', '36 cocktail sticks']	Easy	['Healthy']
canapes	Smoked salmon & poppy seed palmiers	['320g sheet puff pastry', '1 egg, beaten', '1 tbsp poppy seeds', '5 tbsp cream cheese', '100g smoked salmon', 'small bunch chives, snipped']	Easy	['Freezable (uncooked)']
canapes	Mini pizza quiches	['2 large tortilla wraps', '4 eggs', 'chopped vegetables (optional)', '6 slices salami', '3 cherry tomatoes, halved, plus extra to serve', 'handful basil leaves', 'vegetable sticks, to serve']	Easy	[]
canapes	Cheese & Marmite scones	['450g plain flour, plus extra for dusting', '1 tbsp baking powder', '3 tsp yeast extract', '1 large egg', 'about 250ml milk', '1 tbsp sunflower oil', '140g mature cheddar, grated', '100g full-fat cream cheese']	Easy	['Freezable']
canapes	Gyoza	['2 tbsp cornflour', '26 ready-made gyoza skins, defrosted if frozen (see tip)', '2-3 tbsp vegetable oil', '4 spring onions, ends trimmed, roughly chopped', '2 large leaves of Savoy or pointed cabbages, hard stem removed, roughly chopped', 'a 1½cm piece of ginger, peeled and chopped', '1 garlic clove', '50g water chestnuts, about 5 (drained weight)', '2 tsp soy sauce', '2 tsp oyster sauce', '1 tsp cooking saké', '½ tsp sesame oil', '140g minced pork or chicken', '2 tbsp soy sauce', '1 tbsp rice vinegar', '2 tsp sesame oil', '2 tbsp soy sauce', '2 tbsp Yuzu juice', '2 tsp peanut oil']	A challenge	['Freezable (filling and wrappers separately)']
canapes	Teriyaki beef & lettuce cups	['350g trimmed sirloin steak', '2 tbsp teriyaki sauce  marinade, (we used Kikkoman teriyaki marinade)', '1⁄2 cucumber', '2 tbsp coriander, roughly chopped ', 'juice 1⁄2 lime', '6 Little Gem lettuces  leaves ', '1 red chilli, deseeded and thinly sliced', '1⁄2  red onion, thinly sliced']	Easy	['Easily halved']
canapes	Vegan ‘smoked salmon’ toasts	['2 large carrots', '1½ tbsp flaky sea salt', '2 lapsang soushong teabags', 'slices of toasted baguette, sliced and toasted', 'vegan cream cheese', 'dried seaweed, to serve']	Easy	['Vegetarian']
canapes	Black olive tapenade	['290g jar of pitted kalamata black olives (160g drained weight)', '1 tbsp capers', '2 anchovy fillets', '50ml olive oil', '1 tsp red wine vinegar', 'sprig fresh thyme, leaves only (optional)']	Easy	['Gluten-free']
canapes	Vegan mushroom pâté	['2 tbsp olive oil, plus extra for drizzling', '750g chestnut mushrooms, sliced', '2 garlic cloves, sliced', '1 tbsp thyme leaves, plus 2 tsp', '100-150ml soya or coconut cream', 'sourdough toast, to serve', 'caramelised red onion chutney or relish, to serve', '25g caster sugar', '50g walnut halves']	Easy	['Vegetarian']
canapes	Mozzarella sticks with chilli tomato sauce	['30g plain flour', '1 egg, beaten', '100g dried breadcrumbs', 'pinch of dried oregano', 'pinch of garlic granules', '250g block firm mozzarella (not in water), cut into 1cm-thick finger-length strips', 'about 500ml  vegetable oil, for frying', '1 tbsp olive oil', '1-2 red chillies, deseeded and finely chopped', '2 garlic cloves, sliced', '400g can  chopped tomatoes', '1 tsp red wine vinegar', '1 tsp sugar']	More effort	['Vegetarian']
canapes	Potato cakes with smoked salmon & cream cheese	['1kg baking potatoes', '100g butter, melted', '100g plain flour, plus extra for dusting', '1 tsp bicarbonate of soda', '280g tub full-fat cream cheese', '100ml double cream', 'zest and juice 1 lemon', '200g pack smoked salmon slices, cut into strips', 'small bunch dill, fronds picked', '50g caperberries, halved']	Easy	[]
canapes	Baked camembert with bacon-wrapped breadsticks	['400g strong white flour', '7g sachet fast-action dried yeast', '2 tsp English mustard powder', '1 tsp golden caster sugar', '2 tsp thyme leaves, plus extra sprigs for the cheese', '1 tbsp light olive oil, plus extra for greasing', '250g whole camembert in a box', '20 slices pancetta']	More effort	['Freezable (bread only)']
canapes	Duck & pork terrine with cranberries & pistachios	['2 duck breasts, about 300g/10oz each, skin removed and reserved', '200g thinly sliced streaky bacon rashers', '1kg pork shoulder, cubed', '2 slices bread, crusts removed', '100ml milk', '3 shallots, roughly chopped', '1 large garlic clove, roughly chopped', '200g duck or chicken livers, roughly chopped', '6 black peppercorns', '12 coriander seeds', '2 cloves', 'good pinch ground cinnamon', '2 tbsp Cognac or brandy', '2 eggs, beaten', '25g shelled pistachio', '50g dried cranberry']	More effort	['Freezable']
canapes	Spicy mince & lettuce cups	['1 tbsp sunflower oil', 'large piece fresh root ginger, peeled and grated', '2 garlic cloves, crushed', '2 red chillies, deseeded and finely sliced', '500g minced chicken, turkey or pork', '85g light brown sugar', '2 tbsp fish sauce', 'juice 1 lime', '2 lime leaves, finely shredded', 'mix of iceberg lettuce, Little Gem and cos leaves', 'large handful  mint and coriander  leaves, very roughly chopped', 'handful toasted  peanuts, roughly chopped', '2 shallots, finely sliced into rings', '1 lime, cut into wedges']	Easy	['Freezable']
canapes	Tangy roast pepper & walnut dip	['1tsp each ground cumin  and ground pimenton (smoked paprika), plus extra to serve', '6 tbsp extra-virgin olive oil', '100g walnut halves', '225g roasted red pepper from a jar, drained', '1 tbsp tomato purée', '1 garlic clove, crushed', '2 tbsp pomegranate molasses  (or substitute lemon juice or red wine vinegar)']	Easy	['Vegetarian']
canapes	Smoked salmon scotch eggs	['5 good quality eggs, at room temperature', '2 salmon fillets, boneless and skinless, about 240g', '200g good quality smoked salmon', '1 lemon, zested, ½ juiced, ½ cut into wedges to serve', '½ small pack  dill, chopped', '½ small pack parsley, chopped', '1 tbsp capers, chopped', '50g plain flour', 'good pinch cayenne pepper', '100g panko breadcrumbs', 'vegetable oil, for frying', '75g mayonnaise']	More effort	[]
canapes	Prawn filo wraps	['1 bundle dried thread rice noodles (about 60g)', '1 tbsp sunflower oil', '300g pack fresh stir-fry vegetable - go for a leafy mix', 'half finger-length fresh root ginger, grated', 'small bunch coriander, stalks finely sliced, leaves roughly chopped', '200g raw peeled prawn, halved', '2 tbsp sweet chilli sauce, plus extra to serve', '8 small sheets filo pastry', '1 tbsp sesame seeds (optional)']	Easy	['Freezable (Can be frozen uncooked)']
canapes	Beetroot & blackberry cured salmon	['800-1kg side of salmon, pin-boned and scaled', '90g brown sugar', '125g sea salt', '80g blackberries or elderberries', '2 raw beetroots, peeled and chopped', '3 juniper berries, crushed', '4 tbsp gin', '1 bunch of dill, finely chopped', '6 white peppercorns, crushed', '1 tbsp freshly grated horseradish', '2 tbsp gin']	Easy	['Gluten-free']
canapes	Squash, pea & feta frittatinis	['250g butternut squash, peeled, deseeded and chopped into small pieces', '25g frozen peas', '100g feta, crumbled', '4 large eggs']	Easy	['Vegetarian']
canapes	Cheese & garlic-filled mushrooms	['250g small  mushroom', '50g butter', '2 garlic cloves, finely chopped', '1large slice white bread', '4 tbsp finely grated  parmesan (or vegetarian alternative)', '3 tbsp chopped  chive', 'olive oil']	Easy	['Vegetarian']
canapes	Scallops with chorizo & hazelnut picada	['12 queen scallops, cleaned and 4 clean scallop shells', '1 tbsp extra-virgin olive oil, plus extra for drizzling', '80g chorizo, cut into small chunks', 'squeeze of lemon juice', '30g butter', '1 tbsp olive oil', '40g rustic bread (such as sourdough), cut into 1cm cubes', '2 garlic cloves, sliced', '15g skin-on hazelnuts', '½ unwaxed lemon, zested and juiced', '1 tbsp finely chopped coriander', '¼ tsp sherry vinegar', '1 tbsp amontillado sherry']	More effort	[]
canapes	Chorizo scotch quail’s eggs	['1 tbsp vinegar', '12 quail’s eggs', '100g stale bread', '100g blanched almonds', 'small pack flat-leaf parsley', '250g cooking chorizo', '2 hen’s eggs', '3 tbsp plain flour', 'sunflower oil, for deep-frying', '5 tbsp mayonnaise (shop-bought, or try one of our homemade mayonnaise recipes - see goes well with)', '1 tsp smoked paprika']	A challenge	[]
canapes	Serrano-wrapped pear with goat’s cheese	"['6 slices of serrano ham', '1 pear', ""a small log (125g) of goat's cheese (you won't use it all)"", '½ a packet of rocket leaf']"	Easy	['Gluten-free']
canapes	Truffled mushroom pâté	['50g dried porcini mushroom', '2 tbsp butter', '3 shallots, finely chopped', '250g chestnut mushrooms, finely chopped', '2 garlic cloves, crushed', '250g mascarpone', '½ tbsp white wine vinegar', '30g parmesan or vegetarian alternative, finely grated', '3 tbsp truffle oil', 'cornichons and toast, to serve', '100g salted butter', '2 tbsp truffle oil', '3 thyme sprigs, leaves picked', '½ tsp green peppercorn, crushed', '½ tsp pink peppercorns, crushed']	Easy	['Vegetarian']
canapes	Ham & peach nibbles	['6 juicy peaches', 'a small bunch of basil', 'a packet of serrano ham']	Easy	['Gluten-free']
canapes	Quick cheese straws	['350g pack ready-rolled puff pastry', 'four handfuls grated parmesan (or vegetarian alternative)', 'handful flour, to roll pastry on']	Easy	['Vegetarian']
canapes	Naan, spinach & halloumi bites	['2 tbsp butter', '2 crushed garlic cloves', '2 tsp garam masala', '2 x 80g bags washed baby spinach', '2 x 250g packs halloumi cheese', '4 naan bread']	Easy	['Vegetarian']
canapes	Paella arancini bites	['500g cold leftover paella or shop-bought', '50g plain flour', '2 eggs, beaten', '75g dried breadcrumbs', '1 tsp smoked paprika', 'vegetable oil or sunflower oil, for deep frying', '12 thin slices chorizo', '12 green Spanish olives']	Easy	[]
canapes	Spanish tomato bread with jamón Serrano	['4 ripe  tomatoes, chopped', '1 garlic clove, finely chopped', '3 tbsp olive oil', 'salt', 'pepper', '20 slices of baguette', '5-6 slices Serrano ham']	Easy	[]
canapes	Spiced pork crackling straws	['400-500g pork skin, preferably taken from loin of pork and bought un-scored as one piece or ‘sheet’ of skin', '1 ½ tsp fennel seeds', '¼ tsp black peppercorns', '1 star anise', '1 tbsp sea salt flakes, plus extra for sprinkling over at the end ', '½ tsp smoked paprika', 'icing sugar (optional)']	More effort	['Gluten-free']
canapes	Grilled mackerel with escalivada & toasts	['3 very large or 4 medium peppers a mix of colours', '1 red onion, halved and thinly sliced', '3 tbsp extra virgin olive oil', '2 medium aubergines', 'zest 1 lemon, juice of ½', '1 rosemary sprig, finely chopped', '2 tbsp small capers, drained', 'small pack flat-leaf parsley, roughly chopped', '2 rosemary sprigs, finely chopped', '3 garlic cloves, crushed', '3 tbsp extra virgin olive oil, plus extra to serve (optional)', '1 large olive ciabatta, cut into 8 slices', '¼ tsp chilli flakes or hot paprika', '4 mackerel fillets, pin-boned and cut in half if large (or 8 butterflied sardines)']	Easy	['Easily doubled']
canapes	Figs with goat's cheese, pistachios & honey	"['8 ripe figs, halved', ""100g log rind-on goat's cheese"", '30g honey', '20g pistachios, finely chopped', 'a few small thyme sprigs, roughly chopped']"	Easy	['Vegetarian']
canapes	Cheesy spinach & artichoke dip	['vegetable oil, for the dish', '300g chopped frozen spinach, defrosted', '250g soft cheese', '150ml soured cream', '100g mayonnaise', '2 large garlic cloves, finely grated', '75g vegetarian hard cheese, grated', '100g grated mozzarella', '100g grated  vegetarian cheddar', '2 x 280g jars artichokes, drained and roughly chopped', 'tortilla chips and crudités of your choice, to serve']	Easy	['Vegetarian']
canapes	Brie & cranberry filo parcels	['6 sheets filo pastry', '75g melted butter', '4 tbsp cranberry sauce, plus extra to serve', '100g vegetarian  brie, cut into 18 pieces', '1 tbsp poppy seeds']	Easy	['Vegetarian']
canapes	Chicken caesar & crispy prosciutto bites	['2 cooked skinless chicken breasts, cut into small pieces', '2 anchovies, finely chopped', '15g parmesan, finely grated', '4 tbsp mayonnaise', '1 tbsp soured cream', '1 tsp Dijon mustard', '½ tsp garlic granules', '1 tbsp chopped chives, plus extra to serve', '½ lemon, juiced', '20 small  crispbreads or melba toasts', '6 cooked smoked bacon rashers, finely chopped']	Easy	[]
canapes	Artichoke & lemon dip	['280g jar marinated artichoke, drained', '1 garlic clove', '50g pine nut, toasted, plus extra', 'zest and juice 1 lemon', '3 tbsp grated parmesan (or vegetarian alternative)', '20g pack flatleaf parsley, a few leaves reserved', '3 tbsp extra-virgin olive oil']	Easy	['Vegetarian']
canapes	Mozzarella sticks	['400g block mozzarella (not in water)', '50g flour', '2 eggs', '150g breadcrumbs', '2 tsp smoked paprika', '2 tsp dried oregano', 'vegetable or sunflower oil for frying', 'dips, to serve']	Easy	['Vegetarian']
canapes	Tomato tarts with roasted garlic & goat’s cheese	"['3 whole garlic bulbs', '2 tbsp olive oil', '375g block all-butter puff pastry', '1 ½ tbsp honey Dijon mustard (we used Maille) or use 2 tsp Dijon mustard and a squeeze of honey', '325g cherry tomato, halved', '1 egg, beaten', ""150g pack soft goat's cheese (we used Chavroux - other soft goat's cheese would work but mix with a little milk to loosen)"", 'handful basil leaves']"	Easy	['Vegetarian']
canapes	Pea & bacon pasties	['200g pack smoked bacon lardon, cut into small pieces', '225g frozen pea', '140g mascarpone', '25g parmesan, grated, plus a little extra for the tops', '2 medium eggs', 'small handful mint, leaves chopped', '375g pack puff pastry', 'plain flour, for rolling']	Easy	['Freezable']
canapes	Halloumi & bacon rolls	['250g block halloumi cheese', '10 rashers pancetta or smoked streaky bacon', '1 tbsp chopped chives']	Easy	['Gluten-free']
canapes	Beetroot patties	['100g sesame seeds, for coating', '140g raw beetroot, coarsely grated', '140g peeled and coarsely grated apple', '100g feta, coarsely grated', '2 spring onions, very finely chopped', '50g gluten-free oat', '1 large egg', '2 tsp ground cumin', '1 heaped tsp turmeric', '1 large ripe avocado', '8 tbsp pro-biotic live Greek yogurt, or goat’s or cow’s milk', '1 small garlic clove', 'juice ½ lemon']	Easy	['Vegetarian']
canapes	Crab, lime & chilli toasts	['1 small baguette, cut into 12 slices', '2 tbsp olive oil', '140g white crabmeat', '1 red chilli, deseeded and finely chopped', '1 tbsp coriander, chopped', 'zest and juice 1 lime']	Easy	[]
canapes	Barbecue pork buns	['85g sugar', '500g pack  white bread  mix', '1 tbsp sunflower oil', '12 rashers  streaky bacon  unsmoked bacon or pancetta, chopped', 'knob ginger, peeled and chopped', '2 garlic cloves, chopped ', '2 tbsp soy sauce', '3 tbsp clear honey', '3 tbsp tomato purée', '1 egg  beaten, to glaze']	More effort	['Freezable (after second rise for one month)']
cocktails	Rhubarb gin	"['1kg pink rhubarb stalks', ""400g caster sugar (don't use golden - it muddies the colour)"", '800ml gin']"	Easy	['Vegetarian']
cocktails	Sex on the beach cocktail	['ice', '50ml vodka', '25ml peach schnapps', '2 oranges, juiced, plus 2 slices to garnish', '50ml cranberry juice', 'glacé cherries, to garnish (optional)']	Easy	['Vegan']
cocktails	Espresso martini	['100g golden caster sugar', 'ice', '100ml vodka', '50ml freshly brewed espresso coffee', '50ml coffee liqueur (we used Kahlua)', '4 coffee beans (optional)']	Easy	['Vegetarian']
cocktails	Hurricane cocktail	['50ml dark rum', '50ml white rum', '1 passion fruit', '1 orange, juiced', '1 lemon, juiced', '50ml sugar syrup', '2 tsp grenadine', '4 cocktail cherries', '2 orange slices']	Easy	['Vegetarian']
cocktails	Classic margarita	['ice', '50ml tequila reposado', '25ml lime juice', '20ml triple sec', 'salt', '2 lime wedges']	Easy	['Vegan']
cocktails	Aperol spritz	['ice', '100ml Aperol', '150ml prosecco', 'soda, to top up']	Easy	['Vegetarian']
cocktails	Amaretto sour	['200ml amaretto', '3-4 lemons, juiced (you will need 120ml) ', '1 egg white', 'small jar or can of cherries in syrup', 'ice']	Easy	[]
cocktails	Christmas punch	['a bunch of red grapes', '750ml prosecco', '1l cloudy apple juice', 'ice', '250ml sloe gin', '50ml herbal liqueur', '1 ball stem ginger, finely sliced plus 2 tbsp of the syrup', '3-4 sprigs rosemary', '1 clementine, finely sliced']	Easy	['Vegetarian']
cocktails	Mojito pitcher	['6 limes, plus 1 lime sliced, to serve', '4 tbsp granulated sugar', '4-5 mint sprigs', 'ice', '350ml white rum', '600ml sparking water']	Easy	['Vegan']
cocktails	Frozen margarita	"['50ml tequila', '25ml triple sec (we used Cointreau)', '25ml lime juice', ""15ml sugar syrup (see 'Goes well with' below)"", 'large handful of ice', 'wedge of lime, to garnish']"	Easy	['Vegetarian']
cocktails	Mojito recipe	['juice of 1 lime', '1 tsp granulated sugar', 'small handful mint leaves, plus extra sprig to serve', '60ml white rum', 'soda water, to taste']	Easy	[]
cocktails	Raspberry gin	['350g raspberries', '150g sugar', '700ml bottle of gin']	Easy	['Freezable']
cocktails	Classic negroni	['25ml gin', '25ml sweet vermouth', '25ml Campari', 'ice', 'slice of orange']	Easy	['Vegan']
cocktails	Negroni mocktail	['½  grapefruit (approx 125g) ', '1 slice orange', '125g caster sugar', '3 cardamom pods, lightly crushed', 'pinch coriander seeds', 'few drops red food colouring', 'ice', '25ml white grape juice', '1 slice orange (optional)']	Easy	['Vegetarian']
cocktails	Whiskey sour	['50ml bourbon', '35ml lemon juice', '12½ml 2:1 sugar syrup', '2 dashes Angostura bitters', '½  fresh egg white', 'ice', '50p-sized piece of lemon zest', 'slice of  orange and a cherry on a stick']	Easy	['Vegetarian']
cocktails	Mulled gin	['100ml gin', '400ml apple juice', '½ lemon, sliced', '1 bay leaf', '4 cloves', '2 cardamom pods, lightly crushed', '1 small cinnamon stick', '3 juniper berries, lightly crushed', '½ tsp coriander seeds', '1 tsp runny honey', '4 bay leaves', '2 lemon slices, halved']	Easy	['Vegetarian']
cocktails	Easy sangria	['2 oranges, chopped', '2 pears, chopped', '2 lemons, 1 chopped, 1 juiced', '200g red berries, chopped (we used strawberries and cherries)', '3 tbsp caster sugar', '1 tsp cinnamon', 'ice', '750ml bottle light red wine', '100ml Spanish brandy', '300ml sparkling water']	Easy	['Vegetarian']
cocktails	Jessica rabbit cocktail	['2 strawberries', '2 cherry tomatoes, plus 1 extra, to garnish', '10ml agave syrup', '20ml fresh lime juice', '30ml espadin mezcal', '20ml blanco tequila', '20ml pineapple juice', 'ice', 'fresh mint sprig, to garnish']	Easy	['Vegetarian']
cocktails	Palomezcal	['lime juice (optional)', '50ml espadin mezcal', '30ml fresh grapefruit juice', '10ml agave syrup', 'ice', 'soda water', 'slice of grapefruit']	Easy	['Vegetarian']
cocktails	Bloody mary recipe	['large handful of ice', '100ml vodka', '500ml tomato juice', '1 tbsp lemon juice, plus 2 slices to serve', 'few shakes Worcestershire sauce', 'few shakes Tabasco (smoked Tabasco is nice)', 'pinch celery salt', 'pinch black pepper', '2 celery sticks, to serve']	Easy	['Gluten-free']
cocktails	French martini	['40ml vodka', '20ml Chambord liqueur', '60ml pressed pineapple juice', 'pineapple wedge, to serve']	Easy	['Vegetarian']
cocktails	Tom Collins	['50ml gin', '25ml lemon juice', '25ml sugar syrup', '125ml chilled soda water']	Easy	['Vegetarian']
cocktails	Piña colada	['120ml pineapple juice', '60ml white rum', '60ml coconut cream', 'wedge of pineapple, to garnish (optional)']	Easy	[]
cocktails	Fruit punch	['8-10  strawberries, halved or sliced', '½  orange, sliced', '½ lemon, sliced', 'handful of  mint leaves', 'large handful of ice', '500ml pineapple juice', '300ml orange juice', '300ml lemonade']	Easy	['Vegan']
cocktails	Vodka martini	['60ml vodka', '1 tbsp dry vermouth', 'olive or lemon peel, to garnish']	Easy	[]
cocktails	White rabbit cocktail	['80ml gin', '50ml amaretto', '50ml double cream', '1 tsp lemon curd', '¼ tsp  vanilla paste', 'handful of ice', 'edible flowers, to serve']	Easy	['Vegetarian']
cocktails	Homemade raspberry vodka	['500g raspberries', '250g white caster sugar', '2 vanilla pods, split down the centre', '1l vodka']	Easy	['Vegetarian']
cocktails	Summer cup mocktail	['1cm thick slice of  cucumber', '1 sprig  mint', 'few frozen red berries', '120ml clear, sparkling lemonade', 'ice', 'more frozen berries, chopped fruits, cucumber slice, mint, citrus – all optional']	Easy	['Vegetarian']
cocktails	Moscow mule	['50ml vodka', 'crushed ice', '150-200ml ginger beer', 'few dashes of ginger bitters', 'sprig of mint', 'wedge of  lime']	Easy	['Vegan']
cocktails	Fruity mocktail	['handful of green grapes', 'handful of blueberries', '4 tbsp grenadine', '300-400ml orange juice', 'sparkling water, to top up', '4 bamboo skewers']	Easy	['Vegetarian']
cocktails	Mudslide	['50g dark chocolate', 'ice', '60ml coffee-flavoured liqueur', '60ml vodka', '60ml Irish cream liqueur', '100ml double cream']	Easy	['Vegetarian']
cocktails	Pink gin iced tea	['1 chamomile tea bag', '100ml pink gin', '100ml spiced rum', '100ml elderflower cordial', '100ml pink grapefruit juice', 'ice', 'thyme sprigs, to garnish']	Easy	[]
cocktails	How to make eggnog	['50g caster sugar', '4 egg yolks', '1 tsp vanilla essence', '397g can of  condensed milk', '100ml brandy']	Easy	[]
cocktails	Coconut & pineapple cooler	['300ml coconut rum', '600ml pineapple juice (not from concentrate)', '150ml gin', '6 small chunks watermelon', '12 coriander sprigs', '6 x 324ml screw-top jam jars with lids', 'ice bucket filled with ice']	Easy	['Vegetarian']
cocktails	Courgette martini	['1 courgette, coarsely grated', 'juice 2 lemons', '2 tbsp caster sugar', '25ml vermouth', '50ml gin', 'ice', 'mint leaf to garnish']	Easy	['Vegan']
